{
  "schema": "stegverse.master-records-alignment-transition/v1",
  "transition_id": "ALIGN-UNIFIED-CONVERSATION-MATH-GOVERNED-SOLVER-CONSUMER-006",
  "parent_transition_id": "ALIGN-UNIFIED-CONVERSATION-MATH-HOSTED-VALIDATION-005",
  "source_handoff_ref": "StegVerse-Labs/Site/docs/UNIFIED_CONVERSATIONAL_CAPABILITY_MIRROR_HANDOFF.md",
  "source_state_hash": "b01c9197a735eed4f5a460320db1fec01ea5a232d0a4fd87884809ac7d47e3b7",
  "target_state_hash": "b01c9197a735eed4f5a460320db1fec01ea5a232d0a4fd87884809ac7d47e3b7",
  "semantic_delta_hash": "8027755dc42b2459d47ae8328f19fce2e1d087a3b6876ce53f4401afbac167e9",
  "module_id": "StegVerse-Labs/Site:unified-conversational-capability",
  "endpoint_id": "StegVerse-Labs/Site:mathematics-educator-governed-solver-consumer",
  "projection_before_hash": "188f9f50e3a572d8627abc336fee005c115feae6059b330cf6b0f6efdba10b0d",
  "projection_after_hash": "ea4d694d42dae8e781a15834b96595ca1ba11e5e4768ed039c41c4c5700ada65",
  "task_effects": [
    {
      "task_id": "UNIFIED-CONVERSATION-MATH-SPECIALTY-001",
      "disposition": "GOVERNED_SOLVER_CONSUMER_INSTALLED_HOSTED_REVERIFY_PENDING",
      "site_commit": "1f16a9116b44996d6611fd9a69766cb325d015db"
    },
    {
      "task_id": "UNIFIED-CONVERSATION-MATH-ACTIVATION-RECEIPT-CONSUMER",
      "disposition": "FAIL_CLOSED_COMPLETE_RECEIPT_AND_AUTHORITY_CHECKS_INSTALLED",
      "site_commit": "e9bec934942e09ee8c0e899b65649ec5e0ea3598"
    },
    {
      "task_id": "UNIFIED-CONVERSATION-MATH-BOUNDARY-VALIDATOR",
      "disposition": "GOVERNED_SOLVER_BINDING_GUARDS_INSTALLED",
      "site_commit": "8df5129845c23fa5755299379ac1cea8bd378416"
    },
    {
      "task_id": "SITE-MATH-ACTIVATION-WORKFLOW",
      "disposition": "REPOSITORY_MUTATION_AUTHORITY_RETIRED_VALIDATION_ONLY",
      "site_commit": "a2f9e4ed9ee0834a7e26f24661386a13ed4bb8b5"
    },
    {
      "task_id": "SITE-FOUR-APP-MATH-WORKER",
      "disposition": "SOVEREIGN_CARRIER_OBSERVATION_OWNER_RECONCILED",
      "site_commit": "577e3fc1475b00ad7ec8ad6725e4dc1fb8eabef2"
    }
  ],
  "alignment_disposition": "PROPAGATING",
  "reconstruction_state": "PASS",
  "evidence_refs": [
    "receipts/state-alignment/ALIGN-UNIFIED-CONVERSATION-MATH-HOSTED-VALIDATION-005.json",
    "StegVerse-Labs/Site/assets/ecosystem-chat-va-runtime.js",
    "StegVerse-Labs/Site/scripts/advance_math_solver_public_activation.py",
    "StegVerse-Labs/Site/scripts/check_ecosystem_chat_boundary.py",
    "StegVerse-Labs/Site/data/four-app-active-worker-assignments.json",
    "StegVerse-Labs/Site/.github/workflows/math-solver-public-activation.yml",
    "StegVerse-org/LLM-adapter/docs/MATH_SOLVER_RUNTIME_MIRROR_HANDOFF.md",
    "StegVerse-org/LLM-adapter/llm_adapter/math_solver_gateway.py"
  ],
  "authority_effect": "NONE",
  "custody_destination": "master-records/orchestration"
}
